review_id,booking_id,user_id,partner_id,rating,review_text,review_date
1,875,26,25,5,Represent because current opportunity right whole reality return discover buy sit hand speech.,2025-02-17
2,948,107,7,3,Buy society goal book smile agent daughter season around development one.,2025-02-04
3,371,50,1,1,Catch yourself wish half challenge teach yet realize unit they.,2024-05-29
4,410,75,4,5,Candidate when personal interest city must matter.,2025-02-25
5,819,1,2,1,Box federal movement carry get middle impact series develop who according his speak peace.,2025-03-21
6,164,20,1,1,Learn focus nor within quality everyone rule city office entire write even page.,2024-08-03
7,27,48,20,3,Special machine experience could animal glass white reach investment store into community.,2024-11-29
8,984,59,5,2,Arm suddenly operation brother economic bank get brother town letter.,2024-12-03
9,112,98,26,5,Five include minute office event people middle south none maintain magazine hour.,2024-12-23
10,12,173,10,5,Similar man company student both learn military continue who television student now from.,2024-08-10
11,292,198,9,4,State attention key old do common machine weight sure small measure.,2025-02-15
12,643,161,19,5,Town write next another appear candidate include.,2024-09-07
13,515,54,3,1,Pay they turn interview to best half more value tax inside person.,2024-11-08
14,954,153,13,2,End type explain better lay management scientist sport important move personal stuff alone.,2024-10-12
15,140,127,2,4,Behavior they none authority develop every girl.,2024-12-24
16,130,155,19,2,Only voice would value wait market.,2024-09-20
17,197,85,21,5,Prepare specific our appear risk avoid also take plant prevent admit thank big.,2024-10-17
18,947,137,6,3,Hope exactly difficult create night prove sort candidate herself stage more clearly deal.,2025-03-01
19,239,97,1,1,Head remain series floor particular interesting safe result instead nearly style plant.,2025-03-23
20,89,123,9,5,Kitchen price suggest ago sea fall memory include officer.,2025-04-29
21,382,180,8,5,Himself top stuff them mother rest everybody.,2024-08-28
22,565,151,8,5,Later speech bed modern chair traditional finish attention stuff.,2025-02-23
23,864,124,17,3,Hit nature about stock cut long can remain ten quality else politics.,2024-06-25
24,948,132,5,2,Save town thus win rather think truth deal arm.,2024-11-07
25,106,105,14,5,Traditional wish wife probably pay affect decision.,2024-10-03
26,333,196,4,2,Your law draw film majority common feeling floor group street spring place tax.,2025-01-30
27,278,118,16,4,Military relate industry cover party manage guess onto better ever sell concern part.,2025-05-01
28,883,136,25,3,Quality professional three body gas night police among important.,2025-05-11
29,273,198,15,1,Expert benefit when east exist record pattern key.,2025-05-01
30,473,190,14,5,Night know six article industry involve small probably.,2024-07-19
31,438,3,15,5,Move management reason election part partner bring city.,2024-07-15
32,329,10,5,2,Nation fly hot local girl white knowledge agreement his.,2025-03-30
33,951,120,16,4,Money tell teacher meeting adult magazine.,2024-12-01
34,375,146,21,5,Prove seven site will garden smile last production lead technology least wear before.,2025-03-02
35,547,132,12,4,Tonight near member would water forward.,2025-01-14
36,407,11,19,5,Place until exactly help will you bed leader source artist season.,2025-01-28
37,74,139,26,5,Energy him avoid watch item fill anything when which.,2024-11-18
38,292,52,23,4,True little consumer card box bar into inside.,2024-09-15
39,547,7,14,2,Tv pretty set fly window budget energy attack responsibility road base.,2024-07-08
40,431,36,7,1,A federal order sing budget beat watch someone way easy.,2024-07-19
41,144,21,13,2,Cost eye economy participant recently view education radio move.,2025-04-18
42,85,118,21,5,Benefit site smile others his data do street computer guess.,2024-09-15
43,237,161,4,4,Result various political could wind better stage artist morning lose truth sometimes.,2024-11-26
44,501,41,1,1,Another the source so sure audience will.,2024-12-13
45,426,73,5,4,Coach change not throughout official them relate quickly standard add.,2025-02-06
46,74,165,3,4,Whatever radio she would until degree executive become need movie but focus letter.,2024-12-10
47,771,28,25,2,Case model often song read major garden book.,2024-12-21
48,728,134,25,2,Lay floor hard message toward minute campaign beat stay add.,2024-07-30
49,772,32,19,5,Drop old everything cultural however eight claim gun.,2024-07-30
50,633,178,18,1,Best bit space agent everything prevent poor song accept.,2025-02-26
51,501,23,30,3,West many performance sister job risk us one.,2025-03-24
52,415,136,6,5,Fact nature save stop pretty machine interview.,2025-02-21
53,199,61,2,3,Available suffer bag stock keep boy without.,2024-08-29
54,519,73,28,5,Trouble not clearly while piece civil list perform degree service certainly radio.,2024-11-14
55,288,55,17,5,If source surface usually wall few.,2025-03-01
56,188,149,11,1,Simple room truth book official ability American rule owner behind speech someone technology.,2024-08-23
57,869,137,15,5,Whether song month not investment oil support grow.,2025-01-09
58,371,20,2,2,Them article either commercial religious leave long within system Democrat sign all.,2024-12-21
59,216,186,20,2,Together heavy report threat early wish identify road its situation mean.,2025-01-24
60,898,69,25,5,Too her usually process however detail line pressure game pay maintain certainly.,2024-09-11
61,804,19,6,3,Somebody prove reach than today what foot behind position general right push purpose senior.,2025-05-10
62,942,44,10,1,Various through specific style seven house surface character thank professor alone interview.,2024-08-18
63,489,189,19,5,Sit majority develop modern require mean option.,2025-01-27
64,127,49,10,2,Almost poor to foreign spring level boy wait at move try relate behind.,2024-07-12
65,405,34,13,3,Side significant tend community vote authority any.,2025-05-03
66,850,188,3,1,Already degree research along difference get page particularly nor wonder set.,2024-10-15
67,822,167,9,5,Generation music whose job tend make appear which.,2025-01-04
68,664,50,1,3,Treatment indeed ahead star assume benefit old teacher authority just result.,2025-01-18
69,178,15,8,1,Development own affect quickly nothing glass thank.,2024-07-11
70,691,37,2,1,They thousand ever agreement size member.,2025-03-03
71,331,164,3,3,Happen hundred pick bar none project and phone interesting.,2024-09-03
72,46,36,30,4,National news structure hand city then candidate occur attorney.,2024-08-30
73,208,95,6,1,Ever end sort how thing trial man day.,2025-02-06
74,438,70,3,3,Ever today significant dog my out couple campaign family marriage issue.,2024-08-28
75,798,184,4,2,Skill country situation again peace leg then piece PM machine magazine suddenly.,2024-07-14
76,719,111,28,4,Such reflect fund dream author member sell window Mr.,2024-06-22
77,781,64,9,1,Shake cultural million national production beyond police theory seat agreement.,2024-10-06
78,637,139,16,2,Report official instead success top put this third technology.,2025-02-13
79,969,181,2,4,Film concern argue plan head read identify happy rather forget red visit.,2024-07-05
80,614,197,11,1,Their scene special least think nor hit practice human food week end.,2024-11-22
81,99,134,5,1,Hand if view next young far future carry myself imagine require entire.,2024-05-26
82,420,91,13,5,Medical form there also machine position general.,2024-12-11
83,398,5,6,3,Rather board theory despite production teacher future cause power term.,2024-12-09
84,958,66,22,5,Black enjoy pay recent design always.,2025-03-15
85,662,192,30,5,Stock sing do decade information whose through important commercial.,2025-05-09
86,871,134,24,2,Think cold already current expect field everyone tonight section five choice point.,2025-03-21
87,473,132,6,2,Up memory citizen management environmental three sit range mother small society receive middle.,2024-06-30
88,821,112,21,3,Performance suddenly describe soldier senior suddenly reduce organization he shake voice account money.,2024-06-05
89,277,63,28,3,Million owner almost want nature whole business reduce quickly.,2024-08-12
90,986,197,26,2,Appear pass season the shake simple.,2025-05-12
91,730,34,28,3,Read crime plant her quickly offer will reality ready.,2024-06-29
92,424,93,26,5,Character friend really boy class know seem middle seek picture he town government.,2024-10-11
93,483,134,7,4,Garden vote vote when house take.,2024-10-10
94,711,124,3,4,Always wide future easy down present eight product begin very.,2025-01-30
95,399,143,6,1,Position leader hit reduce list strategy house truth every next phone dog.,2025-04-30
96,208,80,10,3,Election beautiful risk much such since do term.,2025-01-18
97,593,169,24,3,Candidate simple as apply remember may indicate number ever size can bed exist movement.,2024-08-04
98,605,21,14,2,Discussion local ground street positive coach mission happy project take might late.,2025-03-02
99,796,94,14,4,Behind prevent but improve information hand study east avoid although surface lawyer six.,2024-11-22
100,243,119,25,5,Share size reflect test place painting result simply final action born knowledge.,2024-08-28
101,706,33,30,4,Style which attorney over service ago voice reveal again throw east amount especially.,2024-09-09
102,642,179,9,1,Close chair worker likely beautiful method across night collection.,2024-09-17
103,989,5,5,5,Them because often matter want some else alone run yard often find respond.,2024-08-13
104,912,158,22,4,Remain agency represent even you language fill.,2024-12-29
105,423,66,9,2,Pretty avoid option a look business.,2024-08-18
106,237,36,6,4,Western serve consumer thing such cell.,2025-02-18
107,303,127,3,1,Rock understand share crime material art argue security pattern summer final.,2024-11-03
108,311,167,27,2,End travel fall region social claim.,2024-06-15
109,810,5,7,1,Republican edge find mention without bad use his that.,2024-09-24
110,58,86,24,3,This give base bag little could court lose.,2025-03-12
111,170,2,28,1,One apply plant work training ago season stand benefit city between everybody likely.,2024-10-19
112,86,142,5,3,Under seem mention little rate green hold music.,2024-10-25
113,10,196,20,4,Age doctor right either maybe century enjoy society anything soldier.,2024-09-22
114,815,195,2,3,Night appear admit fear morning scene party continue them question machine.,2024-10-08
115,355,88,29,3,Worry part cover space by image foreign letter.,2025-01-12
116,836,171,4,4,American real meet future example door front difficult training.,2024-10-22
117,596,28,19,2,Item among suddenly probably resource their.,2024-11-05
118,389,86,8,2,Political southern personal everybody political staff wall cell national down.,2025-03-24
119,24,168,10,5,Wrong once institution general southern amount probably bag.,2024-07-24
120,843,35,21,5,Close have health car back for left scene.,2025-03-04
121,36,120,19,4,Product guess time father provide machine reveal bank pressure already top later north.,2025-03-12
122,440,40,17,5,Child activity personal three four week.,2024-09-11
123,489,34,12,5,Central research while least trial share one hope new official artist.,2024-08-02
124,900,103,12,5,Every hospital already from size sort impact close east agency.,2025-02-23
125,859,127,23,5,Carry large word clearly public source central.,2024-07-09
126,576,100,10,4,Husband weight eye wrong turn question former gas allow project green response.,2024-08-19
127,562,14,13,3,Next we teach family go involve character increase glass although Mr stock.,2024-12-16
128,70,87,7,4,Arm little raise anything vote project something card data.,2024-06-16
129,406,45,11,4,Road loss health officer stay few.,2025-02-06
130,41,34,15,5,Even force everything out long wrong ahead better happy seem term put off.,2024-05-13
131,410,98,27,2,End million between town weight woman old lot method.,2025-01-21
132,29,167,3,2,Grow argue special decision here nice individual on at deal under.,2024-07-08
133,700,73,7,3,Carry series on number rock director wall sign develop represent.,2025-03-04
134,600,12,6,1,Student common maintain interesting player natural seek he commercial.,2024-11-07
135,143,39,21,4,Ten international rather spring dog receive series plant thing drop.,2024-07-20
136,881,51,20,1,Perform smile PM way later special.,2024-07-03
137,741,162,9,1,Choose stand bill professor suffer interest include meet happen perform natural.,2024-08-15
138,307,19,30,2,Hit reflect feel participant job include administration news difference score late year ball.,2024-06-15
139,178,196,20,4,Off onto color debate sense treatment.,2025-03-27
140,733,35,13,4,Customer subject plan work concern though challenge we film form forward.,2025-01-15
141,898,115,5,4,They set discover amount natural time.,2025-02-15
142,811,130,14,1,Necessary player president difficult such particularly sea off change place stand.,2024-06-30
143,80,189,26,1,Choice break fund phone size member.,2024-06-23
144,912,144,8,4,Answer gun green term career yard direction no among.,2025-02-24
145,656,88,26,3,Discussion people few again sea public author strategy door cut same.,2025-02-11
146,119,95,12,1,Each down soon me strong take because behavior fall.,2024-09-17
147,664,11,26,2,Task civil black daughter piece report.,2024-07-31
148,229,63,2,2,Oil artist opportunity seven water deep whole discussion lay south weight your.,2025-01-27
149,784,50,28,5,Dog clear challenge partner worker rather relate course.,2025-04-26
150,558,37,28,1,Professor person want commercial and what hundred listen treat.,2024-06-16
151,787,116,23,2,Key current over hard article join shake small book anyone book color how.,2024-11-26
152,732,57,7,2,Military health point become girl eat offer something hot in expert skill.,2025-04-30
153,29,125,2,3,Political rock push news responsibility type scientist all citizen store walk.,2024-06-10
154,762,83,7,5,East firm according spend while bad say goal room war heart drug.,2024-11-03
155,551,160,23,2,Check drop significant fly budget defense economic present.,2025-03-17
156,598,112,25,1,Result bill only media start effect air including.,2024-12-12
157,212,61,28,3,Give continue throw history purpose the actually keep bit individual state.,2024-12-28
158,268,11,28,4,Place activity six full score around artist.,2024-06-26
159,252,6,8,1,Probably west quite work imagine difference low best baby main either.,2024-06-09
160,77,192,15,4,Heart life fine add job opportunity suffer space full.,2024-07-22
161,375,33,23,2,Suggest hot significant why rest such respond four change special.,2025-03-14
162,242,184,3,1,Mr almost section because of around situation lose key.,2024-12-28
163,13,72,19,2,Long moment Congress into force start serve seek enjoy stand sure.,2025-04-29
164,53,57,23,2,Present weight station peace national actually travel if.,2024-08-27
165,846,16,19,2,Democratic moment those church black accept say service.,2024-06-17
166,630,195,15,1,Animal food art sister national person.,2024-12-29
167,423,10,22,3,Red day specific PM keep evidence short.,2025-02-22
168,394,127,5,2,Analysis in quickly power manager firm quickly set.,2025-01-22
169,958,34,4,3,Draw happen care radio prevent attention sure.,2024-08-25
170,831,196,14,2,Policy hundred somebody tonight else light sense large letter charge several out.,2024-12-12
171,16,94,2,4,Case enter poor old focus tend mouth these election discover.,2025-02-19
172,565,104,8,5,Actually bring which central although be floor call politics fine industry.,2024-11-09
173,183,170,28,2,Might suffer past citizen five rest none attack.,2024-09-02
174,364,96,9,4,Town administration tax body see day ask.,2024-08-18
175,478,115,28,4,Movie kid pattern ten real buy behind because send commercial least federal simply.,2024-12-30
176,787,128,27,1,Country coach chair space under list law food.,2025-04-29
177,82,135,19,1,International forget tonight fly son later draw partner today kind until central.,2025-04-21
178,913,2,14,1,As form lay wait against benefit value prevent surface media.,2024-12-02
179,810,48,17,4,Cell fast prove could physical experience.,2025-02-05
180,755,178,4,5,Last too sit single race model low pattern west.,2024-10-08
181,643,68,15,4,Story nothing need be meeting write as apply political save five.,2025-03-17
182,570,38,8,3,Medical stand base discuss oil nature I change civil attention.,2024-12-06
183,404,160,16,5,Pretty all throughout south everything herself remain.,2025-03-06
184,572,155,19,2,Health medical protect beat in role hard campaign.,2025-03-04
185,438,191,11,4,Wall result recognize reflect technology health our air field.,2024-08-06
186,614,133,24,4,Audience space enjoy of far whether minute though always what media.,2024-11-24
187,485,124,20,3,You court help less president close perform recent pay.,2025-03-30
188,802,58,9,1,Evidence level country any land determine firm real agent pretty recognize career less.,2025-04-26
189,609,156,21,4,My art ready effort much back sit by network compare.,2024-06-19
190,669,105,25,4,Happy simple enjoy police reason everyone arrive often walk.,2025-05-11
191,765,193,23,3,Look arm week home style arm when left.,2024-07-07
192,505,53,28,1,Heart Mr activity hair bag instead often describe available.,2025-03-22
193,612,44,11,4,Give natural partner war else free travel budget anyone describe everybody decide.,2024-09-22
194,591,33,26,4,Least growth speech order kid realize picture manager night current.,2025-03-04
195,489,24,11,5,Per industry protect student husband like pretty over will hundred.,2024-09-02
196,942,103,15,3,Safe computer dog camera store final none those live until dream.,2025-03-11
197,93,162,20,5,Though everyone physical term well accept article recently fall control because over.,2024-08-03
198,499,174,12,1,Listen likely consider six hope particular beautiful walk same.,2024-10-18
199,12,91,18,5,Professional American money travel hold north on prepare between manager may.,2024-11-01
200,137,120,18,3,Peace its strategy discussion good kind letter.,2025-04-11
201,175,186,3,1,Receive pull no citizen majority hundred rock serve west describe speech.,2025-01-13
202,473,4,2,5,Thank wide arm especially clear entire player decision leg into difference.,2024-10-15
203,595,108,13,3,Election speak plant day let near begin establish than them international role security.,2024-06-15
204,899,164,15,1,According individual choice kid try under then party shoulder.,2025-04-02
205,311,113,19,2,Defense apply local level us long should see serve.,2024-08-08
206,951,138,11,4,Imagine man forget service raise could issue against.,2024-10-28
207,365,1,27,3,List cover mean yard game resource area both.,2025-02-16
208,466,66,30,1,Magazine forward whom night not push in over change push me movement.,2025-03-17
209,830,173,18,5,One strategy election adult standard born owner safe daughter draw station.,2025-05-12
210,710,102,29,2,You notice available guy across his method eat.,2025-02-16
211,276,158,22,2,Western career rate report of similar appear current much according experience.,2024-11-26
212,460,115,17,4,Couple affect show single minute very chair perhaps less reality attention well.,2025-01-04
213,594,62,5,2,Short effort whether use more big whole.,2024-11-28
214,814,89,24,5,Certainly back leg occur own candidate record common citizen girl garden.,2024-11-27
215,476,192,10,1,Collection produce heart major certain them.,2024-10-11
216,896,184,27,3,Character maintain record pressure water light movement.,2025-03-06
217,6,193,3,1,Very after listen personal clearly particularly make today.,2025-02-10
218,958,54,29,2,Body before magazine idea wear hospital forget mouth.,2024-11-04
219,605,48,20,4,Impact mother coach your stop specific PM final ever page evidence.,2024-06-11
220,636,144,17,2,Close finally million allow decision prove hear serve task even.,2024-11-05
221,992,10,25,2,Thus issue bill perform last feel.,2024-09-16
222,904,32,3,3,A although wonder probably seat enjoy no hand everybody lay hair about heavy.,2025-04-07
223,48,109,6,4,Indicate able consumer shoulder either magazine lot the Congress ago itself.,2025-02-03
224,178,11,2,1,Camera foot road window actually energy exist mother.,2024-12-15
225,787,183,6,3,Best like personal improve risk weight defense phone relationship maintain table including.,2024-12-05
226,320,59,22,3,Your bad dinner ok name TV task.,2024-05-18
227,461,116,21,5,Enjoy head food grow determine structure talk keep every article least someone.,2024-06-08
228,972,160,18,3,Such remember teacher many beautiful book.,2025-02-19
229,924,34,30,3,Would once your discover top gun week nor else face piece toward with.,2024-05-21
230,954,72,5,3,Should create up along they respond walk name evidence involve challenge.,2024-09-26
231,114,165,29,2,Writer approach hot exactly environment meet ready term.,2024-10-24
232,177,92,16,1,Food realize property relate we agree Mr reduce whom.,2024-09-05
233,907,79,16,3,Identify main go future trial boy character like hit should.,2024-08-15
234,755,45,21,1,Sing huge trial sea management eye.,2024-12-29
235,195,86,5,3,Throughout amount sometimes group beat find purpose.,2025-03-10
236,627,132,19,3,Perform store skill such wait quickly.,2024-09-05
237,277,83,9,2,Citizen onto deep according phone traditional.,2024-11-14
238,607,31,18,2,One parent drug recent set treatment.,2025-04-03
239,703,184,30,3,Small talk class discover difficult alone protect traditional public once.,2025-01-29
240,870,89,17,4,Good choice green example million health scene what son environment brother.,2024-12-18
241,232,150,15,3,Series listen almost half some chair me.,2024-06-03
242,294,164,6,2,Buy strong ok run oil cost bed either analysis figure whether how late.,2025-05-02
243,940,168,3,5,My especially item late after school tell score word answer million admit.,2024-09-07
244,463,8,16,2,Reality improve military place officer series little strategy two.,2024-10-27
245,983,147,1,1,Pm perform teach mouth future a edge store only there role production let.,2024-12-27
246,451,127,27,5,Remain marriage do organization structure commercial identify against suggest wife building side likely but.,2024-08-02
247,282,141,28,2,View decide join great hotel thus turn lay everyone I not water sense.,2024-12-05
248,542,59,7,1,Memory table race strategy figure with far window force.,2024-09-23
249,288,176,10,4,They break agent eye less mention.,2024-06-07
250,399,144,3,5,Well center soon member ready billion.,2024-11-11
251,159,95,15,3,Cause even candidate far town human art idea leave appear financial.,2025-04-14
252,796,137,22,5,Skill thus million debate few for true different specific who.,2024-08-30
253,692,42,10,2,Development after natural nature writer never job.,2025-01-27
254,510,62,25,4,Nature feel happen mission deal better sport partner level western method cut.,2024-10-14
255,602,40,11,3,Unit those tonight control once short above against good arm voice issue.,2025-01-09
256,303,68,27,1,Participant in skill small former discuss about.,2024-10-13
257,634,199,26,4,Than report especially focus soldier pressure employee senior gas.,2025-03-16
258,489,167,23,1,Matter Mrs police successful generation worker firm enough.,2024-05-19
259,190,6,16,4,Nice million street pass everybody evening surface laugh main.,2024-12-19
260,260,159,27,3,Air seven open part sense capital usually interest town.,2024-10-17
261,706,117,20,5,Clearly truth official begin reality on drive thank price.,2024-11-20
262,267,163,25,5,Bed apply difference hear character several health bar.,2024-07-06
263,180,63,28,2,Level show boy might key upon woman nearly quite.,2025-02-17
264,286,55,29,2,Trade about school again available behind.,2025-02-18
265,370,187,23,2,Well process worker data never information star kitchen old question month.,2024-06-01
266,510,106,14,2,Talk fly bad if world third religious PM set.,2024-11-12
267,726,68,14,2,Able population behind air goal mind range maintain each article.,2025-03-28
268,502,101,19,2,Behavior letter interesting around table control inside successful economy.,2024-06-23
269,218,151,14,4,Girl meeting it long impact yard.,2024-11-26
270,930,163,26,1,Also property fire town safe late.,2024-06-18
271,598,61,6,2,Our right marriage whom year serve recognize through discover.,2025-04-28
272,631,158,14,4,Week teacher people none suggest traditional involve seem three leave world.,2024-11-06
273,112,4,10,3,Morning point political law like feel join town through of.,2025-01-14
274,364,122,12,4,Air rest condition particularly voice discover perform final painting.,2024-07-12
275,925,153,15,3,Almost difficult much half against range order cause.,2024-08-05
276,466,64,24,1,Accept new cell strategy family floor heart truth.,2025-03-31
277,264,68,20,1,Discussion practice itself station picture somebody line win.,2025-05-01
278,154,10,4,5,Loss role quite phone many organization close opportunity.,2024-06-15
279,244,163,2,5,Recent heavy mean industry side surface tax.,2024-09-08
280,318,169,7,4,Million pretty behavior language probably usually least wind art fast such.,2025-01-16
281,429,18,12,5,Manage board federal able break free front.,2024-11-11
282,636,15,24,2,Eight child tell gun business do those son.,2024-08-18
283,389,172,10,3,Chair commercial character care entire occur ready table community situation American base big.,2024-09-29
284,903,39,8,3,Religious popular image body tonight draw those explain create and.,2025-04-09
285,246,104,22,2,Against police stand parent machine push send.,2024-11-20
286,327,98,20,1,Notice action push worker head these resource since trip gas discussion reach.,2024-08-07
287,144,104,1,2,Particularly certainly half early even business song bring money call face life boy interview.,2025-04-18
288,734,54,4,1,Far minute head rock know simple room different.,2024-06-14
