review_id,booking_id,user_id,partner_id,rating,review_text,review_date
289,346,198,8,4,Start live camera soon population particular rate factor event half strong.,2024-12-18
290,380,27,4,3,Feeling concern treat suddenly most turn manager send case black apply yard appear.,2024-07-12
291,70,65,25,1,Change stuff report guess until record everyone happy time pick produce goal hard.,2024-10-22
292,151,45,23,1,Other old image medical reality word treatment several since police.,2024-06-30
293,230,181,17,3,Behind right include tax lawyer cost sort account father get yard method.,2025-03-11
294,717,105,2,5,Old wait edge bed form region.,2025-03-28
295,62,105,24,4,Push east interesting ten by right hundred get care.,2025-04-01
296,329,104,12,5,Network standard natural eat surface event family his.,2024-06-11
297,163,14,5,5,Yourself amount sport hope western environmental street chair itself education.,2024-08-11
298,365,60,12,3,Challenge music crime artist even instead film act how response.,2024-09-27
299,403,21,20,1,Oil specific field available foot difference artist those however perform run inside body.,2024-06-26
300,277,145,10,2,Early ball last way such street system with one kind.,2024-06-26
301,713,27,9,4,Give hour personal happy them candidate property lead within citizen during tough face.,2024-06-21
302,389,99,18,1,Guess represent everything care beyond lawyer do.,2024-11-24
303,290,138,26,1,Son smile pull action truth conference require visit everything owner particular bill.,2024-06-27
304,465,155,9,2,Test total seek machine only paper animal less.,2025-03-22
305,681,77,22,5,Leave wind blood fill interview team political.,2024-11-24
306,953,164,16,3,Two natural almost build lose six unit able research statement view base kid.,2024-12-16
307,38,114,14,3,Work quite deal remain election fast son huge door important soon first high.,2024-12-18
308,606,46,15,1,Across significant push Democrat management big born baby vote usually.,2024-08-21
309,886,88,23,5,Executive fact organization rest prevent goal test law look lay.,2025-02-25
310,197,121,14,5,Also health wonder quickly past actually court pass century arm sell.,2024-12-18
311,434,123,7,2,Stay good art bar room ask degree happy world.,2024-11-07
312,25,158,28,4,Step edge section media she test security way huge major.,2025-01-20
313,289,19,18,2,Course force toward another eat expect actually individual.,2024-06-12
314,767,38,22,1,Address must business run staff door program outside structure section.,2025-02-14
315,589,165,15,3,Course blood front owner far boy.,2024-08-14
316,947,176,15,3,Region yourself light take for Mr career threat technology situation rather.,2024-09-27
317,328,5,3,3,Deep use together raise small country event political hope value prepare.,2025-02-02
318,142,49,4,1,Receive major strong close fly policy box benefit.,2024-08-07
319,295,65,14,2,Something conference main hundred region phone same have baby body establish history news.,2024-05-18
320,560,136,23,1,Music interview market mouth explain technology.,2024-05-23
321,448,179,19,4,Final pattern sign in attack structure enter how any trouble wait as plan.,2024-09-05
322,357,196,9,4,Debate phone force really company student appear young total decision school.,2024-10-02
323,57,31,9,4,Do establish out plan clearly opportunity ball data yard firm fill born recognize close.,2024-06-13
324,503,7,21,2,Economic present today listen start way out cost feel present reveal class through.,2025-02-27
325,868,63,28,5,New soon good quite sound sign lead hotel begin involve behavior.,2024-05-16
326,755,6,18,4,Member customer though event front large throughout him.,2025-05-09
327,753,125,10,5,Bring as left building despite song stand experience.,2024-07-31
328,545,156,16,4,Book magazine open author quickly painting with most action teacher back hand receive.,2024-06-04
329,562,146,10,2,Natural table wonder under happy that catch.,2024-06-05
330,157,172,14,2,Sister finally eat test service kind process lay oil can.,2024-12-28
331,978,156,27,5,Raise town cell serve best strategy recognize ten executive apply city.,2024-05-26
332,225,181,5,1,Expert table still course field director million space front.,2024-08-08
333,630,49,22,5,Worry act clear and nature start break friend off argue.,2025-01-30
334,861,52,26,2,Thus career senior and people up detail represent watch.,2024-12-29
335,604,137,1,3,Itself economy describe under check purpose often turn between member.,2024-09-08
336,456,75,7,3,Hospital chance land my product country writer truth little attention perform.,2025-03-01
337,302,174,8,5,Young forget hold fish indeed newspaper.,2024-07-15
338,541,9,12,1,Perform nor computer social degree cultural decide else usually risk.,2025-01-15
339,315,25,10,3,First production apply from by far send theory question pattern safe first.,2024-09-07
340,443,200,30,5,Congress between game sort strong ahead wind and price movement first.,2024-08-23
341,238,182,14,1,Become win great hour clearly what rate these toward always anything.,2025-04-14
342,489,186,4,5,Compare style since mention effect effect item hair city scene.,2024-07-08
343,33,55,8,1,Whether military pull knowledge address power purpose.,2025-01-26
344,35,72,2,3,Camera almost call strong moment successful indicate organization happy feeling.,2025-02-14
345,810,142,6,5,Particular itself performance strong herself opportunity team while allow happen form.,2025-03-13
346,77,147,18,1,Respond night option worry travel win yet.,2024-11-07
347,595,174,6,1,Look rich nearly cut ever think.,2024-12-17
348,194,152,11,2,Choose clearly hospital pick protect kind top task capital they if number environment.,2024-07-28
349,792,120,16,2,Chance popular deep number why million news Congress pretty partner red one.,2024-07-07
350,649,36,11,4,Great manage hundred yes whole line phone might concern television data.,2024-05-13
351,803,140,19,4,Everybody light but difficult cover everybody piece claim yard school.,2024-06-20
352,695,169,18,4,International firm describe join meeting discuss full war.,2024-10-24
353,700,167,15,3,Sure attention society successful here former.,2024-12-08
354,335,188,6,3,Front able manager position as two.,2024-11-10
355,350,41,16,1,Laugh charge sure officer speak market stand wife building build community include responsibility.,2025-01-15
356,728,16,17,1,View ground office nothing away town public west high cover.,2024-08-07
357,822,65,20,5,Window culture certainly clear among nearly article group big fill.,2024-11-29
358,885,28,5,1,Car now soldier let difference not kitchen at message material true wear expert.,2025-01-06
359,889,161,14,1,Debate catch though level reality radio never.,2025-02-06
360,116,47,20,3,Represent then site sister its expect large deep into.,2024-07-05
361,958,15,26,5,Gas single people movement star him toward safe well police high song pass.,2024-12-02
362,203,115,20,5,Challenge whatever stand or group eye contain room.,2025-05-05
363,648,38,20,2,Kid fish would seek else out system tax answer.,2024-11-03
364,406,186,6,5,Rate decision public paper industry language hundred.,2025-01-20
365,325,142,16,4,Store series perhaps free try task key near task act write.,2024-09-12
366,184,113,16,5,Particular allow realize there law fine notice performance standard middle always score turn.,2025-02-21
367,879,145,19,2,Total administration not human at hand after mention charge admit these nice trouble.,2024-11-12
368,455,64,26,4,Ever guy order write sound develop vote.,2025-01-20
369,643,173,9,3,Network activity though forget life present many leader.,2024-11-17
370,820,175,19,1,Tend forget change bed worry science film item.,2024-05-27
371,529,174,25,4,Avoid statement management town keep pick early call could.,2025-01-19
372,852,60,9,4,Eat military couple dark enter risk fight inside inside month improve.,2024-08-10
373,477,118,28,2,Hot usually tell candidate rather account turn teacher current degree music.,2025-03-25
374,841,34,19,1,West community knowledge important heavy bit family fine girl no southern.,2024-05-22
375,325,197,24,5,Us same suddenly amount public experience second travel move south pay.,2025-04-10
376,607,171,17,3,Of create example Republican system not.,2024-08-08
377,85,131,20,5,Week beat become their listen window after effort more serious grow conference many.,2025-01-21
378,868,27,4,3,Whole protect father other west clearly into base.,2024-09-27
379,778,15,15,3,Organization population director enter environmental president huge couple series.,2024-09-13
380,59,78,27,5,Material raise have own live street too worker behavior eight floor.,2025-01-22
381,235,118,12,4,List cell together red cup they wind sure describe want become foreign final word.,2025-04-26
382,675,16,13,3,Party fact research interview dream change arrive.,2024-10-31
383,666,122,19,4,Worry do military stay yeah support several serve.,2025-02-27
384,167,196,19,1,Action bag note local dog current push person indeed.,2025-03-23
385,540,60,16,3,Collection enough need return follow keep manage still particularly suffer conference early approach sound.,2024-05-13
386,468,106,26,4,Reflect since at kitchen sport either perhaps standard.,2024-06-02
387,434,41,9,4,Pm American pull drive catch listen wrong true risk full amount month.,2025-02-09
388,324,190,22,1,Leave different international tough decision reach despite total.,2024-12-19
389,42,153,29,3,Coach develop value pretty debate system cause.,2025-01-14
390,819,86,20,4,Organization water gas give seem water.,2024-08-26
391,298,71,15,3,Reflect car appear last economy region finally after leader class pass.,2024-11-07
392,500,47,30,2,Off phone give throughout trial interest fight place bad risk claim drug radio.,2025-03-07
393,470,12,29,1,Police sing none benefit ahead might government.,2024-07-14
394,566,49,16,5,Know age store nothing week everything call character community early window.,2024-09-22
395,311,81,11,4,Anything kind democratic assume staff travel.,2025-03-10
396,868,41,9,5,Arrive strategy remain important worker low theory bit money.,2024-11-05
397,601,186,26,1,Nothing three career understand quickly rest face word of third how board.,2024-12-07
398,532,183,7,1,Building cultural human writer theory Democrat rather draw.,2024-07-13
399,683,130,1,1,Sell more bit get effect personal before keep child.,2025-02-23
400,543,46,27,5,Add reach worker hard yourself song itself.,2024-07-21
401,404,89,16,5,Account nor view none because sea coach.,2024-11-14
402,170,153,7,5,Everybody system sit account present ground interesting fast here apply.,2025-04-20
403,319,124,8,5,Animal human hand down thus left floor somebody church door attack officer particularly.,2024-10-21
404,355,119,7,3,Teach professional coach last people particular help nor Mrs.,2025-02-24
405,626,2,6,3,Paper certain service reach west way class notice sure nor finish.,2025-01-16
406,92,24,13,1,Such since several goal line certainly plant real recent.,2024-08-29
407,433,70,29,5,Wonder son hot final appear toward.,2025-04-10
408,390,175,14,3,Practice couple foot western direction financial which performance professional as all.,2025-03-30
409,746,154,7,4,Make language fact season old nice necessary clearly perhaps nor much bit particular.,2024-06-21
410,580,73,26,1,Against avoid us occur law bar third lead forward.,2025-04-06
411,382,102,5,5,Bit support shake sign data data task public sit.,2024-12-16
412,467,137,19,3,Hold table professor here party health mouth Republican data nearly probably near.,2025-05-07
413,138,18,13,2,Board anyone resource save arrive teach property accept worry from fall.,2024-07-28
414,109,166,14,4,State watch off special personal such service leave very them upon claim.,2024-12-07
415,16,175,27,2,Phone surface security grow claim tax girl industry reflect piece you cut.,2024-06-16
416,596,112,28,1,Work ago model detail difference mission present physical control although.,2024-05-26
417,879,30,2,1,Wait best true show lay poor.,2024-09-06
418,971,59,18,2,Although because wind computer rise dinner.,2025-01-07
419,63,114,25,3,Religious only letter teacher class fill something exist itself teacher.,2024-12-13
420,665,189,24,2,Full property full staff central deep she do.,2024-07-19
421,597,29,13,2,Beautiful some today nation those bit before tonight spring he truth teach dog.,2024-06-04
422,697,71,26,3,Stop opportunity war model it no author south need popular sell save.,2024-06-02
423,103,68,8,3,Surface main soon strong economy relate talk close conference responsibility.,2024-12-30
424,694,175,28,2,Condition south again drug deal since risk week thought coach.,2024-12-05
425,395,121,25,2,Be Mrs rock scene future safe analysis thing team seek country.,2024-12-21
426,298,185,1,3,Side sell require participant make drive choice design.,2025-01-22
427,804,147,13,4,Phone popular rock event tend necessary strategy hold not guess enter skin.,2025-03-09
428,388,72,29,4,Hair land power skin who media past determine large remember travel election wait.,2024-12-17
429,316,191,23,2,Notice during voice it too third general candidate.,2025-05-12
430,519,174,25,2,Paper before skin toward particularly boy trade firm sport.,2024-06-06
431,569,10,8,2,Join record human five dog power sit meet month check raise.,2024-09-02
432,275,62,11,2,Seek catch sort strategy writer others natural major when best technology.,2024-11-30
433,549,148,22,5,Serve know home down voice machine whole cold poor.,2024-08-16
434,638,32,30,1,Adult move determine reason possible case receive generation play not.,2024-10-13
435,360,19,7,1,Person word party health star surface born house new price.,2025-02-16
436,103,134,2,2,Process least scene movie marriage yourself help doctor.,2025-01-15
437,727,17,6,2,Factor rather trial officer end political structure speak hard suffer pull image your.,2024-06-10
438,703,11,5,4,Environmental now city daughter should point line quite day case.,2024-12-14
439,649,135,29,3,Always only apply stock successful daughter computer try.,2024-12-15
440,60,42,5,2,Century lay push dinner specific happen something agreement require between hope.,2024-10-04
441,506,193,25,2,Buy cut city speak per key close their remain never blood may.,2025-03-13
442,792,62,17,2,Agent appear red born each local tough technology fast interview attack page.,2025-01-09
443,405,146,29,2,The fish you trial represent exist attack partner.,2024-09-05
444,327,140,20,4,Could professor on realize popular its probably recently who ability work full.,2024-06-10
445,237,81,13,3,Mention live meet sense support them will some couple long.,2024-12-12
446,844,106,18,3,Capital under prepare star art admit who picture call clearly TV.,2024-08-13
447,489,50,9,5,Market and have official edge financial record question truth feeling already.,2024-11-22
448,672,30,19,1,Stage law accept worker beat author she me.,2024-08-04
449,723,58,18,1,Democrat between black Mr my campaign these office east nation cover level.,2025-01-28
450,213,190,5,2,Try which peace role newspaper decision.,2025-03-03
451,10,170,7,4,Let despite respond continue maintain rest I write act whole.,2024-10-05
452,400,166,7,2,Amount finish executive main response free people full.,2024-12-23
453,844,102,17,3,Wonder move daughter buy pass morning short learn face special apply trip thousand.,2025-03-02
454,88,198,15,1,Parent newspaper reach there south energy together develop check decade show left.,2025-04-08
455,1,161,29,1,Evening only tax likely market draw while.,2024-10-31
456,320,29,15,5,Back avoid we impact all focus.,2025-02-04
457,509,200,14,2,Power daughter despite western realize wrong phone speech.,2025-02-25
458,817,18,28,1,Field letter music blue side thing card final consumer.,2025-01-12
459,146,186,11,1,Early environmental major get sure stay something kid.,2024-11-08
460,943,126,30,3,Structure six follow movie recognize audience while show.,2024-11-05
461,255,55,1,5,Prepare memory few recently sense everyone professor.,2024-12-04
462,942,158,22,3,Let away everything today sort imagine soldier less choice reveal image.,2024-06-09
463,562,49,8,2,Enjoy available such thank everybody individual apply father shake decade concern spring.,2024-08-12
464,320,81,26,4,Education maintain discuss its follow gas collection.,2025-05-01
465,632,130,23,2,Organization situation green particularly anyone different man during raise physical.,2024-06-24
466,86,87,6,1,Happen lead institution future little particularly PM poor degree director full attack argue.,2024-12-26
467,296,70,24,2,Glass exist drop music choice policy.,2025-01-03
468,168,99,19,2,Cover age television get thousand follow service somebody most dinner move billion.,2025-01-06
469,657,126,27,1,Dark class seek entire pull guess discuss would organization guess institution child beautiful.,2025-03-29
470,50,135,27,2,Fight sea half born arrive get.,2024-12-15
471,525,143,27,3,Four defense certainly short will condition respond science ready offer until drop but politics.,2024-07-19
472,872,200,25,2,Garden whose throw wind this try effort action.,2024-05-22
473,271,99,29,5,Field everything question church plan something effort write.,2024-05-24
474,783,105,8,3,Democrat couple wait summer little report traditional say push.,2025-04-26
475,336,149,10,2,Either two few site media look speech capital true field major crime.,2025-02-18
476,831,196,19,5,Today cup material save say bed ready.,2024-10-15
477,495,4,21,3,Now source simply effect eye list.,2025-04-26
478,516,56,19,4,Price public drive of arrive be believe.,2024-11-16
479,904,74,13,5,Employee feeling race nation risk into successful effect.,2024-12-28
480,185,135,27,5,Hour wish hit safe raise clear out economy political.,2025-05-03
481,980,73,8,5,Might general keep similar stock listen I.,2025-02-16
482,424,179,20,2,Capital daughter garden Mrs information security focus born trial try set.,2025-05-09
483,255,86,23,2,Whole east base nature dinner magazine including research treatment perhaps catch decide.,2024-12-30
484,574,194,26,4,Anyone practice officer science protect trial skill firm.,2024-12-14
485,558,111,1,3,Plant rich home full state set several study task.,2025-02-28
486,369,158,19,5,Class soldier describe sometimes sort cause.,2024-06-24
487,186,121,16,3,Enter bill report establish trade indeed.,2024-08-11
488,776,167,6,2,Source onto challenge boy sort firm tree war great billion ground.,2024-08-26
489,98,79,15,5,Down dog employee field statement despite inside apply book avoid matter age.,2025-05-06
490,40,46,13,3,Relate concern prevent whatever personal in word.,2024-12-31
491,799,180,9,3,Various economic so eye should audience Mrs less history low plant he responsibility.,2024-10-28
492,155,97,17,2,Activity everybody writer blood final civil center.,2024-09-09
493,350,141,6,5,Lay level board write wait process well smile various draw fund.,2024-05-27
494,132,188,27,1,Force better develop test no soon bring head.,2024-05-27
495,342,157,25,3,Team who speak production majority yet prevent herself light treat central war student.,2024-08-29
496,62,91,24,5,Memory rich ask figure voice yes enjoy store deal foot thought.,2024-06-02
497,274,18,6,4,Thus occur let least top customer hear name trial live degree design.,2024-12-14
498,762,1,18,4,Real him director news clearly maybe Mrs exist.,2025-02-28
499,350,52,5,2,Pattern writer great open indicate each give keep.,2024-06-08
500,430,143,28,4,Must school their do television strong audience indicate want interesting.,2024-11-30
